{"artifacts":[{"byte_length":"0","id":"gantry.authoring","media_type":"application/json","profiles":["frontend"],"protocols":[],"requirements":["GNT-15.8-publication-integrity"],"sha256":"e3b0c44298fc1c149afbf4c8996fb92427ae41e4649b934ca495991b7852b855","uri":"https://gantry.example/publication/v1/gantry.authoring.json"},{"byte_length":"0","id":"gantry.conformance","media_type":"application/json","profiles":["analyzer","concurrent-evaluator","durable-runtime","embedding","evaluator","frontend"],"protocols":[],"requirements":["GNT-15.8-publication-integrity"],"sha256":"e3b0c44298fc1c149afbf4c8996fb92427ae41e4649b934ca495991b7852b855","uri":"https://gantry.example/publication/v1/gantry.conformance.json"},{"byte_length":"0","id":"gantry.embedding","media_type":"application/json","profiles":["embedding"],"protocols":[{"family":"embedding","major":1,"minor":0},{"family":"hook","major":1,"minor":0}],"requirements":["GNT-15.8-publication-integrity"],"sha256":"e3b0c44298fc1c149afbf4c8996fb92427ae41e4649b934ca495991b7852b855","uri":"https://gantry.example/publication/v1/gantry.embedding.json"},{"byte_length":"0","id":"gantry.ir","media_type":"application/json","profiles":["analyzer","concurrent-evaluator","durable-runtime","evaluator"],"protocols":[{"family":"canonical-ir","major":1,"minor":0},{"family":"source-language","major":1,"minor":0},{"family":"source-map","major":1,"minor":0}],"requirements":["GNT-15.8-publication-integrity"],"sha256":"e3b0c44298fc1c149afbf4c8996fb92427ae41e4649b934ca495991b7852b855","uri":"https://gantry.example/publication/v1/gantry.ir.json"},{"byte_length":"0","id":"gantry.journal","media_type":"application/json","profiles":["durable-runtime","embedding"],"protocols":[{"family":"journal","major":1,"minor":0},{"family":"recovery-projection","major":1,"minor":0}],"requirements":["GNT-15.8-publication-integrity"],"sha256":"e3b0c44298fc1c149afbf4c8996fb92427ae41e4649b934ca495991b7852b855","uri":"https://gantry.example/publication/v1/gantry.journal.json"},{"byte_length":"0","id":"gantry.spec","media_type":"text/markdown","profiles":["analyzer","concurrent-evaluator","durable-runtime","embedding","evaluator","frontend"],"protocols":[],"requirements":["GNT-15.8-publication-integrity"],"sha256":"e3b0c44298fc1c149afbf4c8996fb92427ae41e4649b934ca495991b7852b855","uri":"https://gantry.example/publication/v1/SPEC.md"},{"byte_length":"0","id":"gantry.values","media_type":"application/json","profiles":["analyzer","concurrent-evaluator","durable-runtime","embedding","evaluator","frontend"],"protocols":[{"family":"configuration","major":1,"minor":0},{"family":"event","major":1,"minor":0},{"family":"value","major":1,"minor":0}],"requirements":["GNT-15.8-publication-integrity"],"sha256":"e3b0c44298fc1c149afbf4c8996fb92427ae41e4649b934ca495991b7852b855","uri":"https://gantry.example/publication/v1/gantry.values.json"}],"publication_index":{"major":1,"minor":0},"publication_revision":"fixture-v1","source_language":{"major":1,"minor":0}}
